{
  "artifact_id": "art_fixture0003",
  "created_at": "2026-01-01T00:00:00Z",
  "digest": "sha256:567664a03647d90de41899cf3e5c9a7815993f41ca0f8d44aee9189d64fe5ec8",
  "labels": {
    "authority": "synthetic",
    "fixture": "prepared"
  },
  "snapshot_eligible": false,
  "source": "synthetic",
  "state": "prepared"
}
