{
  "artifact_id": "art_fixture0002",
  "created_at": "2026-01-01T00:00:00Z",
  "digest": "sha256:7487c9047acbd2d9fda8b0bf959890488a3adac0a5e1e575ddc6be574bd9761d",
  "labels": {
    "authority": "synthetic",
    "fixture": "deferred"
  },
  "snapshot_eligible": false,
  "source": "synthetic",
  "state": "deferred"
}
